{
  "data": {
    "clientId": "9c7b373b-4b8a-4b14-812b-f2759f6648fe",
    "createdAt": "2025-07-29T10:11:13.881Z",
    "createdBy": "INTERNAL_USER#fd70f0ac-4eb3-4159-bcfa-60a325cc1bf2",
    "files": {
      "docxTemplate": {
        "url": "s3://template-mgmt/nhs-notify-main-app/9c7b373b-4b8a-4b14-812b-f2759f6648fe/91be480d-c667-4741-957a-057b6475376/1641027600000.docx"
      }
    },
    "id": "91be480d-c667-4741-957a-057b64753762",
    "language": "en",
    "letterType": "x0",
    "letterVariantId": "letter-variant-id",
    "name": "Example Letter Template",
    "owner": "9c7b373b-4b8a-4b14-812b-f2759f6648fe",
    "personalisationParameters": [
      "test"
    ],
    "templateType": "LETTER",
    "updatedAt": "2025-07-29T11:15:22.776Z",
    "updatedBy": "INTERNAL_USER#fd70f0ac-4eb3-4159-bcfa-60a325cc1bf2"
  },
  "datacontenttype": "application/json",
  "dataschema": "https://notify.nhs.uk/events/schemas/TemplateDeleted/v1.json",
  "dataschemaversion": "1.2.1",
  "id": "20f471d0-367d-4914-bee3-2fa5322d67f1",
  "plane": "control",
  "source": "//notify.nhs.uk/app/nhs-notify-template-management-prod/main",
  "specversion": "1.0",
  "subject": "91be480d-c667-4741-957a-057b64753762",
  "time": "2025-07-29T11:15:22.776Z",
  "type": "uk.nhs.notify.template-management.TemplateDeleted.v1"
}
