{
  "data": {
    "clientId": "d9159bb1-ac8c-467b-a990-b4e559ecdad3",
    "createdAt": "2025-07-29T10:04:32.738Z",
    "createdBy": "INTERNAL_USER#f2590ba5-6856-4207-b2dd-cd43821adf8b",
    "id": "3a58a370-75ab-4788-a75e-cd2572a68523",
    "message": "# Your GP Appointment\n\nDear ((firstName))\n\nYour appointment to visit the doctor is at **((appointmentTime))** on **((appointmentDate))**.\n\nIf you are unable to make your appointment, please click [this link](https://example.com) to cancel.\n\nThank you\n\n((surgeryName))\n",
    "name": "Example NHS App Template",
    "owner": "d9159bb1-ac8c-467b-a990-b4e559ecdad3",
    "templateStatus": "DELETED",
    "templateType": "NHS_APP",
    "updatedAt": "2025-07-29T11:16:24.519Z",
    "updatedBy": "INTERNAL_USER#f2590ba5-6856-4207-b2dd-cd43821adf8b"
  },
  "datacontenttype": "application/json",
  "dataschema": "https://notify.nhs.uk/events/schemas/TemplateDeleted/v1.json",
  "dataschemaversion": "1.2.1",
  "id": "c958dab9-1cb2-4fb8-9990-c48ba1dc5518",
  "plane": "control",
  "source": "//notify.nhs.uk/app/nhs-notify-template-management-prod/main",
  "specversion": "1.0",
  "subject": "3a58a370-75ab-4788-a75e-cd2572a68523",
  "time": "2025-07-29T11:16:24.519Z",
  "type": "uk.nhs.notify.template-management.TemplateDeleted.v1"
}
